{
  "spdxVersion": "SPDX-3.0",
  "dataLicense": "CC0-1.0",
  "name": "bscode-agent-bom",
  "documentNamespace": "https://github.com/WasmAgent/agent-trust-infra/bscode-agent/spdx/3.0",
  "creationInfo": {
    "created": "2026-06-29T00:00:00Z",
    "creators": [
      "Tool: agent-trust-infra/examples-0.0.0-research"
    ],
    "comment": "AgentBOM for bscode agent generated by agent-trust-infra"
  },
  "packages": [
    {
      "SPDXID": "SPDXRef-Agent-bscode-agent-demo-001",
      "name": "bscode agent",
      "versionInfo": "0.1.0",
      "supplier": "Organization: WasmAgent",
      "downloadLocation": "NOASSERTION",
      "filesAnalyzed": false,
      "licenseConcluded": "NOASSERTION",
      "licenseDeclared": "NOASSERTION",
      "description": "WasmAgent bscode agent with tool use capabilities",
      "primaryPackagePurpose": "AI-AGENT",
      "externalRefs": [
        {
          "referenceCategory": "PERSISTENT-ID",
          "referenceType": "purl",
          "referenceLocator": "pkg:wasmagent/bscode-agent@0.1.0"
        }
      ],
      "properties": [
        {
          "name": "agent_id",
          "value": "bscode-agent-demo-001"
        },
        {
          "name": "deployment_context",
          "value": "development"
        },
        {
          "name": "generated_at",
          "value": "2026-06-29T00:00:00Z"
        },
        {
          "name": "granted_scopes",
          "value": "fs:read, fs:write, process:exec, network:outbound, api:github"
        },
        {
          "name": "data_access",
          "value": "local_workspace, github_api"
        },
        {
          "name": "credential_references",
          "value": "github_token"
        },
        {
          "name": "generator",
          "value": "agent-trust-infra/examples"
        },
        {
          "name": "generator_version",
          "value": "0.0.0-research"
        }
      ]
    },
    {
      "SPDXID": "SPDXRef-Model-claude-sonnet-4-6",
      "name": "claude-sonnet-4-6",
      "versionInfo": "2025-06",
      "supplier": "Organization: Anthropic",
      "downloadLocation": "NOASSERTION",
      "filesAnalyzed": false,
      "licenseConcluded": "NOASSERTION",
      "licenseDeclared": "NOASSERTION",
      "description": "Anthropic Claude Sonnet 4-6 model used by the bscode agent",
      "primaryPackagePurpose": "AI-MODEL",
      "externalRefs": [
        {
          "referenceCategory": "AI-MODEL",
          "referenceType": "purl",
          "referenceLocator": "pkg:wasmagent/claude-sonnet-4-6@2025-06"
        }
      ],
      "properties": [
        {
          "name": "provider",
          "value": "anthropic"
        },
        {
          "name": "capabilities",
          "value": "tool_use, code_generation, code_review, file_editing"
        }
      ]
    },
    {
      "SPDXID": "SPDXRef-Tool-file-read",
      "name": "Read",
      "versionInfo": "1.0",
      "supplier": "NOASSERTION",
      "downloadLocation": "NOASSERTION",
      "filesAnalyzed": false,
      "licenseConcluded": "NOASSERTION",
      "licenseDeclared": "NOASSERTION",
      "description": "File read tool with fs:read permission",
      "primaryPackagePurpose": "LIBRARY",
      "properties": [
        { "name": "tool_id", "value": "file-read" },
        { "name": "source", "value": "builtin" },
        { "name": "permissions", "value": "fs:read" },
        { "name": "risk_signals", "value": "" }
      ]
    },
    {
      "SPDXID": "SPDXRef-Tool-file-write",
      "name": "Write",
      "versionInfo": "1.0",
      "supplier": "NOASSERTION",
      "downloadLocation": "NOASSERTION",
      "filesAnalyzed": false,
      "licenseConcluded": "NOASSERTION",
      "licenseDeclared": "NOASSERTION",
      "description": "File write tool with fs:write permission",
      "primaryPackagePurpose": "LIBRARY",
      "properties": [
        { "name": "tool_id", "value": "file-write" },
        { "name": "source", "value": "builtin" },
        { "name": "permissions", "value": "fs:write" },
        { "name": "risk_signals", "value": "" }
      ]
    },
    {
      "SPDXID": "SPDXRef-Tool-file-edit",
      "name": "Edit",
      "versionInfo": "1.0",
      "supplier": "NOASSERTION",
      "downloadLocation": "NOASSERTION",
      "filesAnalyzed": false,
      "licenseConcluded": "NOASSERTION",
      "licenseDeclared": "NOASSERTION",
      "description": "File edit tool with fs:read and fs:write permissions",
      "primaryPackagePurpose": "LIBRARY",
      "properties": [
        { "name": "tool_id", "value": "file-edit" },
        { "name": "source", "value": "builtin" },
        { "name": "permissions", "value": "fs:read, fs:write" },
        { "name": "risk_signals", "value": "" }
      ]
    },
    {
      "SPDXID": "SPDXRef-Tool-bash-exec",
      "name": "Bash",
      "versionInfo": "1.0",
      "supplier": "NOASSERTION",
      "downloadLocation": "NOASSERTION",
      "filesAnalyzed": false,
      "licenseConcluded": "NOASSERTION",
      "licenseDeclared": "NOASSERTION",
      "description": "Bash execution tool with process:exec, fs:read, fs:write permissions",
      "primaryPackagePurpose": "LIBRARY",
      "properties": [
        { "name": "tool_id", "value": "bash-exec" },
        { "name": "source", "value": "builtin" },
        { "name": "permissions", "value": "process:exec, fs:read, fs:write" },
        { "name": "risk_signals", "value": "command_execution" }
      ]
    },
    {
      "SPDXID": "SPDXRef-Tool-content-grep",
      "name": "Grep",
      "versionInfo": "1.0",
      "supplier": "NOASSERTION",
      "downloadLocation": "NOASSERTION",
      "filesAnalyzed": false,
      "licenseConcluded": "NOASSERTION",
      "licenseDeclared": "NOASSERTION",
      "description": "Content search tool with fs:read permission",
      "primaryPackagePurpose": "LIBRARY",
      "properties": [
        { "name": "tool_id", "value": "content-grep" },
        { "name": "source", "value": "builtin" },
        { "name": "permissions", "value": "fs:read" },
        { "name": "risk_signals", "value": "" }
      ]
    },
    {
      "SPDXID": "SPDXRef-Tool-file-glob",
      "name": "Glob",
      "versionInfo": "1.0",
      "supplier": "NOASSERTION",
      "downloadLocation": "NOASSERTION",
      "filesAnalyzed": false,
      "licenseConcluded": "NOASSERTION",
      "licenseDeclared": "NOASSERTION",
      "description": "File glob tool with fs:read permission",
      "primaryPackagePurpose": "LIBRARY",
      "properties": [
        { "name": "tool_id", "value": "file-glob" },
        { "name": "source", "value": "builtin" },
        { "name": "permissions", "value": "fs:read" },
        { "name": "risk_signals", "value": "" }
      ]
    },
    {
      "SPDXID": "SPDXRef-MCP-cloudflare-docs",
      "name": "search_cloudflare_documentation",
      "versionInfo": "1.0",
      "supplier": "NOASSERTION",
      "downloadLocation": "NOASSERTION",
      "filesAnalyzed": false,
      "licenseConcluded": "NOASSERTION",
      "licenseDeclared": "NOASSERTION",
      "description": "Cloudflare Docs MCP server for documentation search",
      "primaryPackagePurpose": "APPLICATION",
      "properties": [
        { "name": "tool_id", "value": "cloudflare-docs-mcp" },
        { "name": "source", "value": "mcp" },
        { "name": "mcp_server_id", "value": "cloudflare-docs" },
        { "name": "permissions", "value": "network:outbound" },
        { "name": "risk_signals", "value": "ssrf" }
      ]
    },
    {
      "SPDXID": "SPDXRef-MCP-github",
      "name": "create_or_update_pull_request",
      "versionInfo": "1.0",
      "supplier": "NOASSERTION",
      "downloadLocation": "NOASSERTION",
      "filesAnalyzed": false,
      "licenseConcluded": "NOASSERTION",
      "licenseDeclared": "NOASSERTION",
      "description": "GitHub MCP server for PR management",
      "primaryPackagePurpose": "APPLICATION",
      "properties": [
        { "name": "tool_id", "value": "github-mcp" },
        { "name": "source", "value": "mcp" },
        { "name": "mcp_server_id", "value": "github" },
        { "name": "permissions", "value": "network:outbound, api:github" },
        { "name": "risk_signals", "value": "exfiltration, privilege_escalation" }
      ]
    },
    {
      "SPDXID": "SPDXRef-Plugin-lsp-diagnostics",
      "name": "get_diagnostics",
      "versionInfo": "1.0",
      "supplier": "NOASSERTION",
      "downloadLocation": "NOASSERTION",
      "filesAnalyzed": false,
      "licenseConcluded": "NOASSERTION",
      "licenseDeclared": "NOASSERTION",
      "description": "LSP diagnostics plugin with fs:read permission",
      "primaryPackagePurpose": "LIBRARY",
      "properties": [
        { "name": "tool_id", "value": "lsp-diagnostics" },
        { "name": "source", "value": "plugin" },
        { "name": "permissions", "value": "fs:read" },
        { "name": "risk_signals", "value": "" }
      ]
    },
    {
      "SPDXID": "SPDXRef-Prompt-system",
      "name": "system_prompt",
      "versionInfo": "1.0",
      "supplier": "NOASSERTION",
      "downloadLocation": "NOASSERTION",
      "filesAnalyzed": false,
      "licenseConcluded": "NOASSERTION",
      "licenseDeclared": "NOASSERTION",
      "description": "System prompt used for agent configuration",
      "primaryPackagePurpose": "FILE",
      "properties": [
        { "name": "system_prompt_hash", "value": "sha256:a1b2c3d4e5f6a7b8c9d0e1f2a3b4c5d6e7f8a9b0c1d2e3f4a5b6c7d8e9f0a1b2" },
        { "name": "template_ids", "value": "bscode-system-v1, bscode-implementer-v1" }
      ]
    }
  ],
  "relationships": [
    {
      "spdxElementId": "SPDXRef-Agent-bscode-agent-demo-001",
      "relationshipType": "DEPENDS_ON",
      "relatedSpdxElement": "SPDXRef-Model-claude-sonnet-4-6",
      "comment": "Agent depends on the AI model for inference"
    },
    {
      "spdxElementId": "SPDXRef-Agent-bscode-agent-demo-001",
      "relationshipType": "CONTAINS",
      "relatedSpdxElement": "SPDXRef-Tool-file-read",